{
  "schemaVersion": "release-ops/extension/v1",
  "id": "dotnet",
  "type": "stack",
  "version": "1.1.0",
  "status": "supported",
  "configSchemaVersion": "release-ops/extension-config/dotnet/v1",
  "configSchema": "assets/extension-schemas/stack.schema.json",
  "docs": "docs/stacks/dotnet.md",
  "dependencies": [],
  "detection": {
    "all": [],
    "any": [
      "*.sln",
      "*.csproj"
    ],
    "content": []
  },
  "questions": [
    {
      "id": "buildUnits",
      "type": "build-units",
      "required": true
    },
    {
      "id": "versioning",
      "type": "versioning",
      "required": true
    }
  ],
  "targets": { "linux": "ubuntu-latest", "windows": "windows-latest", "macos": "macos-latest" },
  "processors": [
    {
      "schemaVersion": "release-ops/processor/v1",
      "id": "build",
      "stage": "build",
      "module": "scripts/processors/stack.mjs",
      "entrypoint": "buildProcessor",
      "requires": [],
      "provides": [
        {
          "capability": "build-units",
          "merge": "append"
        },
        {
          "capability": "version-sources",
          "merge": "append"
        },
        {
          "capability": "built-artifacts",
          "merge": "append"
        },
        {
          "capability": "debug-artifacts",
          "merge": "append"
        }
      ],
      "before": [],
      "after": [],
      "secretRoles": [],
      "permissions": {
        "commands": [
          {
            "id": "build",
            "executable": "config:command"
          }
        ],
        "networkOrigins": []
      }
    }
  ],
  "runtimeFiles": [
    "scripts/processors/stack.mjs"
  ]
}
